smartctl 7.2 2020-12-30 r5155 [x86_64-linux-5.14.0-70.13.1.el9_0.x86_64] (local build)
Copyright (C) 2002-20, Bruce Allen, Christian Franke, www.smartmontools.org

=== START OF INFORMATION SECTION ===
Model Family:     Hitachi Ultrastar A7K2000
Device Model:     Hitachi HUA722020ALA330
Serial Number:    JK1151YAHVU2NZ
LU WWN Device Id: 5 000cca 221da4752
Add. Product Id:  DELL(tm)
Firmware Version: JKAOA25C
User Capacity:    2,000,398,934,016 bytes [2.00 TB]
Sector Size:      512 bytes logical/physical
Rotation Rate:    7200 rpm
Form Factor:      3.5 inches
Device is:        In smartctl database [for details use: -P show]
ATA Version is:   ATA8-ACS T13/1699-D revision 4
SATA Version is:  SATA 2.6, 3.0 Gb/s
Local Time is:    Sat Jul  2 18:51:30 2022 EDT
SMART support is: Available - device has SMART capability.
SMART support is: Enabled

=== START OF READ SMART DATA SECTION ===
SMART overall-health self-assessment test result: PASSED

General SMART Values:
Offline data collection status:  (0x84)	Offline data collection activity
					was suspended by an interrupting command from host.
					Auto Offline Data Collection: Enabled.
Self-test execution status:      (   0)	The previous self-test routine completed
					without error or no self-test has ever 
					been run.
Total time to complete Offline 
data collection: 		(21301) seconds.
Offline data collection
capabilities: 			 (0x5b) SMART execute Offline immediate.
					Auto Offline data collection on/off support.
					Suspend Offline collection upon new
					command.
					Offline surface scan supported.
					Self-test supported.
					No Conveyance Self-test supported.
					Selective Self-test supported.
SMART capabilities:            (0x0003)	Saves SMART data before entering
					power-saving mode.
					Supports SMART auto save timer.
Error logging capability:        (0x01)	Error logging supported.
					General Purpose Logging supported.
Short self-test routine 
recommended polling time: 	 (   1) minutes.
Extended self-test routine
recommended polling time: 	 ( 355) minutes.
SCT capabilities: 	       (0x003d)	SCT Status supported.
					SCT Error Recovery Control supported.
					SCT Feature Control supported.
					SCT Data Table supported.

SMART Attributes Data Structure revision number: 16
Vendor Specific SMART Attributes with Thresholds:
ID# ATTRIBUTE_NAME          FLAG     VALUE WORST THRESH TYPE      UPDATED  WHEN_FAILED RAW_VALUE
  1 Raw_Read_Error_Rate     0x000b   100   100   016    Pre-fail  Always       -       0
  2 Throughput_Performance  0x0004   133   133   000    Old_age   Offline      -       100
  3 Spin_Up_Time            0x0007   114   114   024    Pre-fail  Always       -       631 (Average 631)
  4 Start_Stop_Count        0x0012   100   100   000    Old_age   Always       -       39
  5 Reallocated_Sector_Ct   0x0033   100   100   005    Pre-fail  Always       -       1
  7 Seek_Error_Rate         0x000a   100   100   000    Old_age   Always       -       0
  8 Seek_Time_Performance   0x0004   110   110   000    Old_age   Offline      -       40
  9 Power_On_Hours          0x0012   096   096   000    Old_age   Always       -       31124
 10 Spin_Retry_Count        0x0012   100   100   000    Old_age   Always       -       0
 12 Power_Cycle_Count       0x0032   100   100   000    Old_age   Always       -       39
192 Power-Off_Retract_Count 0x0032   100   100   000    Old_age   Always       -       44
193 Load_Cycle_Count        0x0012   100   100   000    Old_age   Always       -       44
194 Temperature_Celsius     0x0002   181   181   000    Old_age   Always       -       33 (Min/Max 21/45)
196 Reallocated_Event_Count 0x0032   100   100   000    Old_age   Always       -       1
197 Current_Pending_Sector  0x0022   100   100   000    Old_age   Always       -       0
198 Offline_Uncorrectable   0x0008   100   100   000    Old_age   Offline      -       0
199 UDMA_CRC_Error_Count    0x000a   200   200   000    Old_age   Always       -       0
223 Load_Retry_Count        0x000a   100   100   000    Old_age   Always       -       0
241 Total_LBAs_Written      0x0012   100   100   000    Old_age   Always       -       109311436316
242 Total_LBAs_Read         0x0012   100   100   000    Old_age   Always       -       455188272532

SMART Error Log Version: 0
No Errors Logged

SMART Self-test log structure revision number 1
Num  Test_Description    Status                  Remaining  LifeTime(hours)  LBA_of_first_error
# 1  Short offline       Completed without error       00%         9         -
# 2  Extended offline    Completed without error       00%         9         -
# 3  Short offline       Completed without error       00%         1         -

SMART Selective self-test log data structure revision number 1
 SPAN  MIN_LBA  MAX_LBA  CURRENT_TEST_STATUS
    1        0        0  Not_testing
    2        0        0  Not_testing
    3        0        0  Not_testing
    4        0        0  Not_testing
    5        0        0  Not_testing
Selective self-test flags (0x0):
  After scanning selected spans, do NOT read-scan remainder of disk.
If Selective self-test is pending on power-up, resume after 0 minute delay.

