smartctl 7.2 2020-12-30 r5155 [x86_64-linux-5.14.0-70.13.1.el9_0.x86_64] (local build)
Copyright (C) 2002-20, Bruce Allen, Christian Franke, www.smartmontools.org

=== START OF INFORMATION SECTION ===
Device Model:     SAMSUNG SSD CM871 2.5 7mm 128GB
Serial Number:    S26PNSAG609269
LU WWN Device Id: 5 002538 7a00170df
Firmware Version: FXT01D1Q
User Capacity:    128,035,676,160 bytes [128 GB]
Sector Size:      512 bytes logical/physical
Rotation Rate:    Solid State Device
Form Factor:      2.5 inches
TRIM Command:     Available
Device is:        Not in smartctl database [for details use: -P showall]
ATA Version is:   ACS-2, ATA8-ACS T13/1699-D revision 4c
SATA Version is:  SATA 3.1, 6.0 Gb/s (current: 6.0 Gb/s)
Local Time is:    Sat Jul  2 19:07:56 2022 EDT
SMART support is: Available - device has SMART capability.
SMART support is: Enabled

=== START OF READ SMART DATA SECTION ===
SMART overall-health self-assessment test result: PASSED

General SMART Values:
Offline data collection status:  (0x00)	Offline data collection activity
					was never started.
					Auto Offline Data Collection: Disabled.
Self-test execution status:      (   0)	The previous self-test routine completed
					without error or no self-test has ever 
					been run.
Total time to complete Offline 
data collection: 		(    0) seconds.
Offline data collection
capabilities: 			 (0x53) SMART execute Offline immediate.
					Auto Offline data collection on/off support.
					Suspend Offline collection upon new
					command.
					No Offline surface scan supported.
					Self-test supported.
					No Conveyance Self-test supported.
					Selective Self-test supported.
SMART capabilities:            (0x0003)	Saves SMART data before entering
					power-saving mode.
					Supports SMART auto save timer.
Error logging capability:        (0x01)	Error logging supported.
					General Purpose Logging supported.
Short self-test routine 
recommended polling time: 	 (   2) minutes.
Extended self-test routine
recommended polling time: 	 (  40) minutes.

SMART Attributes Data Structure revision number: 1
Vendor Specific SMART Attributes with Thresholds:
ID# ATTRIBUTE_NAME          FLAG     VALUE WORST THRESH TYPE      UPDATED  WHEN_FAILED RAW_VALUE
  5 Reallocated_Sector_Ct   0x0033   100   100   010    Pre-fail  Always       -       0
  9 Power_On_Hours          0x0032   099   099   000    Old_age   Always       -       2211
 12 Power_Cycle_Count       0x0033   099   099   000    Pre-fail  Always       -       501
175 Program_Fail_Count_Chip 0x0033   100   100   010    Pre-fail  Always       -       0
176 Erase_Fail_Count_Chip   0x0033   100   100   010    Pre-fail  Always       -       0
177 Wear_Leveling_Count     0x0013   098   098   005    Pre-fail  Always       -       25
178 Used_Rsvd_Blk_Cnt_Chip  0x0013   100   100   010    Pre-fail  Always       -       0
179 Used_Rsvd_Blk_Cnt_Tot   0x0013   100   100   010    Pre-fail  Always       -       0
180 Unused_Rsvd_Blk_Cnt_Tot 0x0013   100   100   010    Pre-fail  Always       -       1063
181 Program_Fail_Cnt_Total  0x0033   100   100   010    Pre-fail  Always       -       0
182 Erase_Fail_Count_Total  0x0033   100   100   010    Pre-fail  Always       -       0
187 Reported_Uncorrect      0x0033   100   100   000    Pre-fail  Always       -       0
195 Hardware_ECC_Recovered  0x001b   200   200   000    Pre-fail  Always       -       0
241 Total_LBAs_Written      0x0033   099   099   000    Pre-fail  Always       -       4166385977
242 Total_LBAs_Read         0x0033   099   099   000    Pre-fail  Always       -       2331146785

SMART Error Log Version: 1
No Errors Logged

Warning! SMART Self-Test Log Structure error: invalid SMART checksum.
SMART Self-test log structure revision number 1
Num  Test_Description    Status                  Remaining  LifeTime(hours)  LBA_of_first_error
# 1  Short offline       Completed without error       00%      1751         -
# 2  Short offline       Completed without error       00%      1313         -
# 3  Short offline       Completed without error       00%       638         -
# 4  Offline             Completed without error       00%       368         -
# 5  Offline             Completed without error       00%       340         -
# 6  Short offline       Completed without error       00%       254         -
# 7  Short offline       Aborted by host               90%         2         -

Warning! SMART Selective Self-Test Log Structure error: invalid SMART checksum.
SMART Selective self-test log data structure revision number 1
 SPAN  MIN_LBA  MAX_LBA  CURRENT_TEST_STATUS
    1        0        0  Not_testing
    2        0        0  Not_testing
    3        0        0  Not_testing
    4        0        0  Not_testing
    5        0        0  Not_testing
  255        0    65535  Read_scanning was never started
Selective self-test flags (0x0):
  After scanning selected spans, do NOT read-scan remainder of disk.
If Selective self-test is pending on power-up, resume after 0 minute delay.

